"newsletter","date","headline","body"
"TLDR","2022-05-02 10:19:06+00:00","The product analytics suite you can host yourself (Sponsor)","With PostHog's open source analytics platform, customer data never has to leave your infrastructure.Featuring product analytics, session recording, feature flags, heatmaps, and more - all available for free.The best part is everything is seamlessly integrated, so you can spend less time configuring different tools and more time getting valuable insight into user behavior. Learn more."
"TLDR","2022-05-02 10:19:06+00:00","Airbnb announces it won’t dock employees’ pay if they go remote (3 minute read)","Airbnb will allow the vast majority of its employees to work remotely without having to take a pay cut if they move away from the company's offices. The company had its most productive period over the last two years while working remotely. Employees will be able to live and work in over 170 countries for up to 90 days a year in each location. There will be regular team gatherings for employees to meet and connect. Airbnb plans to release two major products a year."
"TLDR","2022-05-02 10:19:06+00:00","Pixel Watch is powered by a 300mAh battery and offers cellular connectivity (3 minute read)","The Pixel Watch will have a 300mAh battery. There have been three models leaked so far. Cellular connectivity will be offered on at least one model. The watch could be powered by Samsung Exynos, the same chip as the Galaxy Watch 4, which has a 247mAh battery that lasts between 24 to 40 hours, depending on the model size."
"TLDR","2022-05-02 10:19:06+00:00","Long-awaited accelerator ready to explore origins of elements (7 minute read)","The Facility for Rare Isotope Beams (FRIB) at Michigan State University can create rare isotopes of elements. It can potentially produce hundreds of isotopes that have never been synthesized before. FRIB started construction in 2014 and cost $942 million. The facility will hold its official inauguration today. FRIB will allow scientists to discover how many neutrons can be added to a nucleus and how this changes the interactions inside the nucleus."
"TLDR","2022-05-02 10:19:06+00:00","A Quantum of Sensing—Atomic Scale Bolsters New Sensor Boom (9 minute read)","Quantum sensors use the fragility of quantum effects to achieve extraordinary sensitivity to the slightest disturbances in the environment. They could be used to study brain conditions, reveal hidden underground features, detect Covid-19 in seconds with just a few hundred strands of viral DNA, navigate underground and underwater without GPS, and more. This article discusses the many possible applications of quantum sensors and the current state of projects in the field."
"TLDR","2022-05-02 10:19:06+00:00","DFlex (GitHub Repo)","DFlex is a drag-and-drop library for all JavaScript frameworks for manipulating DOM elements. It can traverse DOM without calling the browser API, transform elements instead of reordering the DOM tree, animate movements, target DOM nodes individually, and more. DFlex is the only library on the internet so far that manipulates DOM instead of reconstructing it. A live demo is available on its website."
"TLDR","2022-05-02 10:19:06+00:00","Wireit (GitHub Repo)","Wireit makes npm scripts smarter and more efficient. It automatically runs dependencies between npm scripts in parallel, watches and re-runs scripts on changes, caches output locally and remotely on GitHub actions for free, and it works with single packages, npm workspaces, and other monorepos. Wireit is still in alpha."
"TLDR","2022-05-02 10:19:06+00:00","The automation platform Atlassian & Slack swear by (Sponsor)","Learn about Workato, the fastest-growing enterprise automation platform during this year's Automate conference, which features sessions with Serena Williams, the CIO of GitLab, the ""Godfather of MarTech"" and more. Learn more."
"TLDR","2022-05-02 10:19:06+00:00","Europe Starts Its Own Social Networks (2 minute read)","The European Data Protection Supervisor (EDPS) has announced that it will publicly pilot its own social networks. EU Voice will be a way for European institutions and agencies to communicate. It will be based on Mastodon, an open-source alternative to Twitter. EU Video will be an alternative to YouTube based on PeerTube, an open-source platform. The EDPS already has Instagram and Spotify alternatives. There are no advertisements or user profiling on the platforms."
"TLDR","2022-05-02 10:19:06+00:00","Tasting Coca-Cola’s first “gamer” flavor—and the history of game-and-soda tie-ins (12 minute read)","Coca-Cola has released a gamer flavor called Coca-Cola Byte. The drink launch was paired with a Fortnite 'creator island' zone made by an advertising agency. It has a fruity flavor similar to Coca-Cola's Creations line of limited-time sodas launched earlier this year. This article discusses the new drink and Coca-Cola's history with games and game advertising."
"TLDR","2022-04-29 10:19:17+00:00","Engineering metrics for high-performing teams (Sponsor)","Swarmia gives engineering teams metrics and visibility into their workflow and possible bottlenecks.“Swarmia gives us the perfect overview of engineering productivity. I can quickly see how we're doing in terms of cycle time and pull requests, which helps me report back to the business.”Roland Fiala, SVP of Engineering at ProductsupStart shipping faster today!"
"TLDR","2022-04-29 10:19:17+00:00","Snapchat’s flying camera (7 minute read)","Snap has released a camera drone called Pixy. The drone weighs just 101 grams and is small enough to fit in a pants pocket. It can follow users around to capture photos or videos. Pixy's battery can last for five to eight flights at around 10 to 20 seconds each. The footage is synced wirelessly to Snapchat for editing and can be shared directly in the app or elsewhere. A video explaining the Pixy is available in the article."
"TLDR","2022-04-29 10:19:17+00:00","Microsoft Edge is getting a built-in VPN powered by Cloudflare (2 minute read)","Microsoft Edge Secure Network is a feature recently discovered on a Microsoft support page. It provides a service similar to a proxy or VPN that encrypts browsing data and prevents online tracking. Users will get 1GB of free data per month. The feature has not been released yet, but it is likely to be available soon. A screenshot of the feature is available in the article."
"TLDR","2022-04-29 10:19:17+00:00","New diamond wafers made in Japan can store 1 billion Blu-Ray discs of data (1 minute read)","A Japanese company and researchers from Saga University have developed a new method to mass-produce two-inch wafers made of diamond. The ultra-high-purity diamonds could be used for quantum computing, which requires diamonds with less than three parts per billion of nitrogen atoms. Previous attempts at creating these diamonds resulted in crystals that were only about four millimeters square. The company plans to commercialize the diamonds in 2023."
"TLDR","2022-04-29 10:19:17+00:00","From seawater to drinking water, with the push of a button (5 minute read)","MIT researchers have developed a portable desalination unit that can remove particles and salts to generate drinking water. The water it produces exceeds World Health Organization quality guidelines. Weighing less than 10 kilograms, the device requires less power to operate than a cell phone charger. Using electrical power lowers its maintenance requirements, allowing the device to be deployed in remote and severely resource-limited areas. The machine can produce 0.3 liters of water per hour using 20 watts of power per liter."
"TLDR","2022-04-29 10:19:17+00:00","Zag (GitHub Repo)","Zag is a JavaScript API that implements common component patterns using the state machine methodology. It can be used to build UI components in React, Solid, or Vue without worrying about the logic. Zag can adapt components to multiple frameworks with a focus on accessibility."
"TLDR","2022-04-29 10:19:17+00:00","Redis 7.0 Is Out! (2 minute read)","Redis 7.0 is now available. It adds almost 50 new commands and options. The most notable improvements are Redis Functions, AVLv2, command introspection, and Sharded Pub/Sub. A lot of development was focused on making Redis more performant, stable, and lean. More details about the update are available in the article."
"TLDR","2022-04-29 10:19:17+00:00","Automate the Debugging Process With Airbrake (Sponsor)","Airbrake Error and Performance Monitoring automates the process of finding bugs quickly. When you install Airbrake, you’ll be alerted to any errors within your application, right down to the exact line of broken code. Add Airbrake to your tech stack, today! Learn more."
"TLDR","2022-04-29 10:19:17+00:00","With Lens Cloud, Snap offers backend services for its developer platform (3 minute read)","Snap has launched Lens Cloud, a server-side component for its developer platform that will help developers build dynamic, multiplayer experiences. Lens Cloud will let developers take advantage of multi-user services, use location-based services to anchor Lenses to places, and store assets on Snap's servers and load them on demand. Lenses are augmented reality apps that can be accessed in Snapchat. The storage service will launch in the coming months. Lens Cloud is free for Snap AR developers."
"TLDR","2022-04-29 10:19:17+00:00","Genetics goes to the dogs, finds there’s not much to breed behavior (8 minute read)","Many dog breeds are about appearance, but plenty of others are devoted to specific tasks. A team of US-based researchers conducted a study on around 18,000 dogs to study dog behavior and its underlying genetics. With a few exceptions, most behaviors are only loosely associated with specific breeds. Many modern breeds only originated about 150 years ago, and complicated behaviors are shaped by many factors."
"TLDR","2022-04-28 10:18:12+00:00","Got the Big Tech Cloud bill blues? (Sponsor)","Vultr's here with the cure! Deploy instances for as low as $2.50 in 60 seconds or less from more than 20 locations around the globe. Get started with $200 credit toward your first 30 days with this TLDR-exclusive offer."
"TLDR","2022-04-28 10:18:12+00:00","Here's the Massive Kit Apple Will Send to Your House So You Can Fix Your iPhone (1 minute read)","Apple has launched its Self Service Repair program. Customers in the US will now be able to repair their iPhones from home. The unexpectedly large kits will have all the tools required to repair an iPhone 12 or iPhone 13 lineup model or the third-generation iPhone SE. They will be rented to customers for $49. A picture of the repair kits is available in the article."
"TLDR","2022-04-28 10:18:12+00:00","Netflix’s Big Wake-Up Call: The Power Clash Behind the Crash (9 minute read)","Netflix's recent earning calls revealed lower than expected subscriber growth. Some are blaming the company culture for its troubles. Ted Sarandos, co-CEO of the company, pushed for quantity of content at the expense of quality. Cindy Holland, who played a key role in launching some of the service's originals, fought to increase the quality of shows but was criticized for spending too freely. The company culture changed profoundly after Holland's departure."
"TLDR","2022-04-28 10:18:12+00:00","Building electronic devices via chemical reactions (4 minute read)","Almost all demonstrations of atomically small machines are essentially assembled by hand. A team of scientists has successfully used a chemical reaction to bind two atomically thin materials, graphene and molybdenum disulfide, potentially paving the way for mass production. The bridge molecule can be used to alter graphene's behavior in different ways. Details about the technique are available in the article."
"TLDR","2022-04-28 10:18:12+00:00","Physicists Developed a Superconductor Circuit Long Thought to Be Impossible (3 minute read)","Superconductors could take supercomputing technology to a whole new level, but there are many challenges in trying to design superconducting components. A team of scientists recently discovered a technique that can direct superconducting electrons down a one-way street, which is needed for components like diodes, without external magnetic fields. There are still many problems with superconductivity to overcome before they can be used in next-generation computing. For example, the phenomenon typically only occurs in materials chilled to just above absolute zero."
"TLDR","2022-04-28 10:18:12+00:00","Gradio (GitHub Repo)","Gradio makes it easy to create user interfaces for machine learning models in Python. It can generate shareable links and get feedback on model performance. Gradio has built-in manipulation and interpretation tools for debugging. A GIF demo is available."
"TLDR","2022-04-28 10:18:12+00:00","FortuneSheet (GitHub Repo)","FortuneSheet is a drop-in JavaScript spreadsheet library based on Luckysheet. It uses a data structure that is compatible with Luckysheet and has features that make it comparable to Excel and Google Sheets. An online demo is available."
"TLDR","2022-04-28 10:18:12+00:00","Volvo Uses InfluxDB to Evolve Its DevOps Monitoring to Enable Data-Driven Decisions (Sponsor)","Production delays or stoppages are the bane of any manufacturer. Learn how Volvo replaced their 15-year-old DevOps monitoring process and enabled data-driven operations, simplified DevOps monitoring, and improved real-time alerting with InfluxDB. Learn more."
"TLDR","2022-04-28 10:18:12+00:00","Japanese Railroad Builds Giant Gundam-Style Robot to Fix Power Lines (2 minute read)","West Japan Rail Company is using a giant Gundam-style robot to fix remote railway power lines. The robot is piloted by a human wearing a virtual reality setup. The robot is still just a prototype and won't be put to work widely until 2024. A video of the robot doing its job is available in the article."
"TLDR","2022-04-28 10:18:12+00:00","Transparent solar panels could replace windows in the future (3 minute read)","Transparent solar panels have the potential to shift cities from major energy users to providers in an instant. There are several transparent solar panel technologies. Some can convert almost any glass sheet or window into a transparent solar panel. The more transparent a panel is, the less efficient it is, so scientists still need to increase the technology’s efficiency before it can be scaled up."
"TLDR","2022-04-27 10:20:50+00:00","Decrease recovery time with a single search (Sponsor)","Search across all your repositories to find and resolve vulnerabilities in minutes, not days. Sourcegraph’s code intelligence platform enables developers to understand, fix, and automate across their entire codebase. Identifying & resolving security vulnerabilities is painful...but it doesn't have to be. Learn more."
"TLDR","2022-04-27 10:20:50+00:00","Android 13’s beta is no longer just for developers (2 minute read)","The Android 13 beta is now available for anyone with a compatible Pixel device. It will feature a new photo picker for restricting app access to photos, new app icon theming options, a new notification permission, and support for Bluetooth Low Energy Audio. There are also some developer-focused changes. The full release of Android 13 is expected later in the year."
"TLDR","2022-04-27 10:20:50+00:00","Apple will delist App Store apps that haven’t been updated recently (3 minute read)","Apple plans to remove apps on its App Store that haven't been recently updated. Developers have 30 days to submit an update for approval. The policy is intended to make it easier for customers to find apps that fit their needs. Apps that are removed from the App Store due to this policy will remain fully functional for users who already have the app installed. Google has also announced similar plans."
"TLDR","2022-04-27 10:20:50+00:00","This printer is made of 600 strands of DNA that put themselves together (6 minute read)","Researchers have created a printer using self-assembling strands of DNA. DNA components are attracted to each other and can find each other if connected in the right way. While our bodies use DNA to communicate genetic information, its properties make it useful for building on a molecular scale. The technology could eventually lead to novel ways of manufacturing complex molecules."
"TLDR","2022-04-27 10:20:50+00:00","Researchers develop a paper-thin loudspeaker (6 minute read)","MIT engineers have developed a paper-thin loudspeaker that can turn any surface into an audio source. The speaker can produce high-quality sounds on a variety of surfaces. It can be made into any size and uses only a fraction of the power used by traditional loudspeakers. The speaker has a high enough resonance frequency to be used for ultrasound applications. A video showing off the speaker is available in the article."
"TLDR","2022-04-27 10:20:50+00:00","Zed (GitHub Repo)","Zed uses a super-structured data model to make data easier to manipulate and manage. It uses a data format that is syntax-compatible with JSON but with a comprehensive type system. Zed supports simple keyword searches as well as powerful data transformation operators that provide as much detail as desired."
"TLDR","2022-04-27 10:20:50+00:00","Hush (Website)","This site contains an introductory guide to Hush. Hush is a modern shell scripting language. It aims to enable the development of robust and maintainable shell scripts. Hush is a good fit for scenarios where external programs need to be put to work together."
"TLDR","2022-04-27 10:20:50+00:00","SSH Made Easy with Tailscale (Sponsor)","Easy, secure SSH connections forever with less than 5 minutes of setup. Connect from anywhere to anywhere. Our free plan is free forever. Install now."
"TLDR","2022-04-27 10:20:50+00:00","Here's what the world's first floating city in Busan, South Korea, could look like (2 minute read)","The South Korean city of Busan recently unveiled a prototype for a floating city. Floating cities could be a way to mitigate the effects of climate change. Busan is a critical port city that will have to adapt to rising sea waters. The floating city will have modular pieces, each designed for a specific use. Artist renderings of the project are available in the article."
"TLDR","2022-04-27 10:20:50+00:00","Nukes, Nubs And Coners: The Unique Social Hierarchy Aboard A Nuclear Submarine (11 minute read)","This article describes the social structure and culture of United States Navy submarines. Every crewmember starts as a NUB, or Non-Useful Body, and has to earn their dolphins to become a member of the subculture. Nukes are crewmen that work in the engine room and Coners are those that work anywhere forward of the engine room. The article provides a description of the NUB experience as well as an overview of the different types of Nukes and Coners."
"TLDR","2022-04-26 10:18:37+00:00","Meetings suck. Not at Shopify. See how they run efficient meetings and 1:1s (Sponsor)","Shopify's teams run short, effective meetings through collaborative agendas and time-saving automations. Shopify uses Fellow.app, the G2 top rated meeting agenda software. Fellow comes packed with customizable templates and integrates with all your tools including Slack, Jira, Trello, and more. Stop attending meetings that are a waste of time. Try Fellow for free today."
"TLDR","2022-04-26 10:18:37+00:00","Twitter accepts Elon Musk's buyout deal (4 minute read)","Twitter's board has accepted Elon Musk's offer to buy the company. The board had considered fighting the hostile takeover by adopting a poison pill strategy. It had concerns over the sale price and Musk's ability to fund the deal. The board changed its mind after Musk's SEC filing which detailed his plans to finance the deal. Musk is exploring a tender offer to purchase Twitter shares directly from shareholders. Twitter's board members have been asked to preserve records related to Musk's bid for a potential congressional probe and subpoenas."
"TLDR","2022-04-26 10:18:37+00:00","Meta is opening its first retail store next month (3 minute read)","Meta is opening its first hardware retail store on its campus at Burlingame, California on May 9. The store will have areas for visitors to demo Portal devices, Quest virtual reality headsets, and Ray-Ban Stories smart glasses. It will open from 11 AM to 6 PM Monday through Friday. The store will allow Meta to experiment with its in-store customer experience and help define its future retail strategy."
"TLDR","2022-04-26 10:18:37+00:00","Elon Musk’s The Boring Company to take on hyperloop project (2 minute read)","Elon Musk's The Boring Company will attempt to build a high-speed hyperloop in the coming years. Musk outlined the idea of the transport system in 2013. The hyperloop involves sending passengers and cargo in pods through low-pressure tubes at speeds above 700 miles per hour. Several companies have been working on the idea for almost a decade, but there are no working examples of the system anywhere in the world. The Boring Company recently raised $675 million in a Series C funding round."
"TLDR","2022-04-26 10:18:37+00:00","Scientists Capture Living Giant Squid (2 minute read)","A ten foot giant squid washed ashore in western Japan and was taken into captivity. It is likely the first time a live specimen has been captured. The squid was transported to an aquarium in the city of Sakai. Not much is known about the species, as they are incredibly rare. A video of the giant squid in shallow waters is available in the article."
"TLDR","2022-04-26 10:18:37+00:00","Atuin (GitHub Repo)","Atuin replaces shell history with an SQLite database and records additional context for commands. It can synchronize fully encrypted shell histories between machines and calculate statistics such as 'most used command'. Atuin can run on zsh, bash, and fish."
"TLDR","2022-04-26 10:18:37+00:00","HyperUI (Website)","This site contains a collection of free Tailwind CSS components. The size of each component can be adjusted. Categories include alerts, buttons, carts, forms, tables, tags, and much more. The code for each component can be easily viewed and copied."
"TLDR","2022-04-26 10:18:37+00:00","Introducing Service Level Management with New Relic (Sponsor)","Manage service level objectives and service level indicators in New Relic with an easy, one-click setup and personalized views. Get started quickly and use the powerful recommendations engine to take the complexity and manual legwork away from establishing SLOs and SLIs. Learn more."
"TLDR","2022-04-26 10:18:37+00:00","Reddit officially launches its Community Funds program with a $1 million investment (2 minute read)","Reddit is investing $1 million into its Community Funds program. The program provides financial support to help Reddit users bring their ideas for events and projects to life. It has so far funded 13 projects nominated by communities on its platform, including a digital conference for history buffs and a billboard in Times Square. Reddit will start accepting submissions for projects needing up to $50,000 in funding in June."
"TLDR","2022-04-26 10:18:37+00:00","Shanghai video overwhelms Chinese censor, gets 400m views (2 minute read)","A video of audio snippets from Shanghai recorded over the course of the lockdown posted on April 22 gained over 400 million views over the next day. While the content of the video comes across as fairly balanced, it triggered China's public opinion control system, which eventually resulted in it being completely blocked. Accounts forwarding the video were restricted following the incident. A subtitled copy of the video is available in the article."
"TLDR","2022-04-25 10:18:36+00:00","Bake data privacy into your app from day one by avoiding these common mistakes (Sponsor)","Your business needs to move fast, but not at the expense of data privacy. As you aim to balance speed and security, don’t lose sight of the most common privacy pitfalls and how you can avoid them. Learn more about data privacy and what your company should avoid doing with the free white paper: Avoiding the Five Cardinal Sins of Data Security and Privacy."
"TLDR","2022-04-25 10:18:36+00:00","Meta hiring freeze for E4-E6 (1 minute read)","Meta is cancelling scheduled virtual onsite interviews. Not all interviews are being canceled, but Blind users are reporting that some interviews between E3 to E6 were canceled. The hiring freeze suggests that Meta may be taking defensive measures against a potentially disappointing quarterly earnings report."
"TLDR","2022-04-25 10:18:36+00:00","Google, Meta, and others will have to explain their algorithms under new EU legislation (4 minute read)","The EU's new Digital Service Act will force tech companies to take greater responsibility for content on their platforms. The new rules will distinguish between companies of different sizes, with the largest companies facing the most scrutiny. Non-compliance can result in fines of up to six percent of a company's annual turnover. The act still needs to be officially voted into law, but the last step is mostly a formality. More details about the new rules are available in the article."
"TLDR","2022-04-25 10:18:36+00:00","SpaceX signs its first deal for Starlink inflight Wi-Fi (2 minute read)","SpaceX has signed a deal with air carrier JSX to offer Starlink onboard Wi-Fi to customers. Starlink currently has around 2,000 satellites in orbit providing internet access. The company has been working on ways to implement its services on commercial aircraft over the past year. JSX customers will be able to access the service for free when it launches later this year."
