"newsletter","date","headline","body"
"TLDR","2022-04-11 10:17:57+00:00","Scientists Rewind The Clock of Human Skin Cells to Make Them Act 30 Years Younger (3 minute read)","Scientists from the Babraham Institute in the UK have reset human skin cells to a more youthful state in terms of certain molecular measurements. Previous research found that it was possible to turn normal cells into stem cells, but these cells would lose their specific identity. The new technique stops before the stem cell state is reached, allowing the cell to retain its original identity and function. The mechanism behind the technique is not fully understood. The technique still needs to be tested on other types of cells in the body and assessed for safety before it can be used in clinical trials."
"TLDR","2022-04-11 10:17:57+00:00","Reliably Send an HTTP Request as a User Leaves a Page (8 minute read)","There's no guarantee that an in-process HTTP request will be successful when a page is terminated in the browser. Sending data on page termination can be very unreliable, which can be an issue when creating logs for data-sensitive business decisions. This article looks at why this happens and ways to make in-process HTTP requests more reliable."
"TLDR","2022-04-11 10:17:57+00:00","RisingWave (GitHub Repo)","RisingWave is a cloud-native streaming database that uses SQL as the interface language. It consumes streaming data, performs continuous queries, and updates results dynamically. RisingWave can collect and transform data from streams, create materialized views for data, and perform data queries. Everything in RisingWave is done via Postgres-compatible SQL."
"TLDR","2022-04-11 10:17:57+00:00","Cut JS Debug Time in Half Using Airbrake (Sponsor)","Airbrake can tell you exactly where an error is in your app, right down to the line of broken code. Plus, it will show you what happened leading up to the error, including clicks, keypresses, navigational updates, and more. Click here to learn more about this cool Airbrake feature!"
"TLDR","2022-04-11 10:17:57+00:00","Startup Says It’s About to Start Selling Lab-Grown Tiger Steaks to Restaurants (2 minute read)","Primeval Foods plans to cultivate and sell a range of exotic meats, including zebra, lion, elephant, and tiger. The lab-grown meat company uses small samples of tissues from healthy wild animals to create its meat. The animals are not killed in the process. Primeval Foods will preview its meats at a couple of Michelin-starred restaurants in London. Other startups, like Orbillion Bio, are also trying to create novel types of lab-grown meats."
"TLDR","2022-04-11 10:17:57+00:00","The era of fixing your own phone has nearly arrived (6 minute read)","Google and Samsung have agreed to provide spare parts for their phones. The US made it legal to open up many devices for the purpose of repair last October. France's repairability scorecard system, which rates devices on how repairable they are, has had a significant effect on consumer choice. Studies on the system have shown that consumers are willing to give up on their favorite brand for products with a higher repairability score. Some types of repairs may still need to be done through the manufacturer."
"TLDR","2022-04-08 10:17:48+00:00","66% of investors regret making impulsive investment decisions (Sponsor)","That's why quantitative hedge funds hire computer scientists to build algorithms that eliminate human biases (fear, greed, FOMO) from investing.With Composer you can invest in quant-based strategies for free - no Python or Excel required.Check out some of their most popular strategies (1 year returns):Big Tech Momentum (+63%)Biotech Sweet 16 (+122%)Leveraged Sectors Inflation Hedge (+46%)Explore Composer Today*"
"TLDR","2022-04-08 10:17:48+00:00","Google Lens 'multisearch' lets you ask questions about photos, now in beta on Android and iOS (2 minute read)","Google Lens now lets users ask questions about photos. Multisearch allows users to start searches with an image and then add text to modify the search. While the tool can perform many types of searches, its best results are for shopping queries. Google Lens multisearch is now available in beta for users in the US on Android and iOS."
"TLDR","2022-04-08 10:17:48+00:00","Twitter test lets you 'unmention' yourself in tweets (1 minute read)","Twitter is rolling out a feature that lets users remove themselves from conversations. The 'Unmention' feature is currently only available for some users through Twitter's web interface. Twitter has other features to keep mentions civil, such as its anti-harassment Safety Mode that automatically blocks mean-spirited users. The new Unmention feature will allow users to have more direct control over unwanted mentions."
"TLDR","2022-04-08 10:17:48+00:00","Oxford spinoff demonstrates world-first hypersonic ""projectile fusion"" (6 minute read)","First Light Fusion is celebrating its first confirmed fusion reaction. The company's approach to fusion involves firing a projectile from a railgun at a falling target in a process designed to generate pressure levels high enough to create shockwaves that cause small deuterium fuel pellets to implode and start fusion reactions. The technique was inspired by the pistol shrimp, which can snap its claws so fast that the water around them is vaporized, creating shockwaves and bubble cavities that heat to tens of thousands of degrees. First Light is working towards creating a pilot plant in the 2030s. Many more details about the technology, including a video showing the reactor design, are available in the article."
"TLDR","2022-04-08 10:17:48+00:00","Stanford engineers invent a solar panel that generates electricity at night (6 minute read)","Solar panels emit infrared radiation at night. The photons going out into the night sky cool down the solar cell. This temperature difference can be used to generate electricity using a device called a thermoelectric generator. While the method won't generate a huge amount of electricity, it still has many applications. Being able to generate small amounts of electricity at night could reduce the need for batteries and the costs they incur."
"TLDR","2022-04-08 10:17:48+00:00","Zaplib (GitHub Repo)","Zaplib is a library for speeding up web applications using Rust and WebAssembly. It allows developers to write high-performance code in Rust alongside existing JavaScript code. Zaplib is designed to be incrementally adoptable, so components can be ported over to Rust one at a time. Demos are available in the docs."
"TLDR","2022-04-08 10:17:48+00:00","What part of the developer experience is hardest for companies to get right? (4 minute read)","In this article, Protocol interviews developers to find out what part of the developer experience is hardest for companies to get right. Companies are often lacking in tools, documentation, and communication. Not getting these things right slows down development. The best companies work to create environments that help developers build products."
"TLDR","2022-04-08 10:17:48+00:00","Prototyping an IoT Application with InfluxDB (Sponsor)","It's easy to stand up an IoT monitoring app in InfluxDB. Here's a step-by-step tutorial. The prototype is serverless, with zero infrastructure to manage and free — we built this app on the free tier of InfluxDB. Learn more."
"TLDR","2022-04-08 10:17:48+00:00","Scientists Used Over 100,000 MRIs to Map The Human Brain Across Our Entire Lifetime (3 minute read)","Researchers have created a database that contains 123,984 magnetic resonance imaging scans taken from 101,457 individuals. The scans were collected from over 100 previous studies and cover every stage of life. They reveal new milestones and confirm developments that have only been previously hypothesized about. The database is designed so that new data can be easily added. A link to the database is available in the article."
"TLDR","2022-04-08 10:17:48+00:00","The Scoop: Inside Fast’s Rapid Collapse (19 minute read)","Fast, a startup that launched in 2020, laid off all of its workforce on April 5. This article discusses what happened, Fast's hiring process, warning signs within the company, and the current situation with Fast. It gives some advice on how to avoid joining similar companies. Most startups are losing money, so it is important to pay attention to the path to profitability, not just growth numbers."
"TLDR","2022-04-07 10:18:09+00:00","Elon Musk recommends real assets (Sponsor)","With inflation on the way, Elon gave his Twitter followers one piece of advice: invest in real assets. What happened next? An NYC startup's traffic spiked. It had unlocked one of the greatest real assets you’ll find: artwork. No wonder over 380,000 people signed up. Follow his advice and invest in real assets today with Masterworks. Learn more."
"TLDR","2022-04-07 10:18:09+00:00","Uber looks to create travel ‘superapp’ by adding planes, trains, and rental cars (1 minute read)","Uber plans to add trains, buses, planes, and car rentals to its UK app this year. It will expand these services to other countries if the test goes well. The company is aiming to become a one-stop shop for all travel needs. It plans to add hotel bookings in the future. Uber recently secured a 30-month license to continue operating in London after a battle with city regulators over its ride-hailing app."
"TLDR","2022-04-07 10:18:09+00:00","Meta plans virtual currency, creator coins for its apps (2 minute read)","Meta is planning to introduce virtual tokens and cryptocurrencies to its apps. It will use the tokens to reward creators and for lending and other financial services. The tokens could give Meta a new revenue channel and control over transactions on its platforms. Meta's tokens might not be blockchain-based and may be centrally controlled by the company. Meta is part of the Crypto Open Patent Alliance, a group that pledges to promote open access to cryptocurrency technologies."
"TLDR","2022-04-07 10:18:09+00:00","OpenAI's DALL-E 2 produces fantastical images of most anything you can imagine (3 minute read)","OpenAI's DALL-E AI is capable of generating images based on attributes from a written description. It can also combine multiple images into a collage. DALL-E was trained with objectionable images removed from its training data and the system actively prevents creating pictures with specific keywords to prevent abuse. The newest version allows users to edit images and generate variations of existing images. Examples of artworks created by DALL-E are available in the article."
"TLDR","2022-04-07 10:18:09+00:00","Rocket Lab prepares its chopper to catch a returning booster in midair (3 minute read)","Rocket Lab plans to catch the first stage of its Electron booster midair with a customized helicopter later this month. The first stage will deploy a parachute and slow down to 10 meters per second before the helicopter will make its attempt. Previous tests of the procedure with replica models have been successful. A 14-day launch window for the test will open up on April 19."
"TLDR","2022-04-07 10:18:09+00:00","Coding for SSDs – Part 6: A Summary – What every programmer should know about solid-state drives (9 minute read)","This article is part of a six-part series on coding for SSDs. The series covers in detail the architecture of SSDs and how they work. This part summarizes the whole series. It covers the basics of SSDs and all of the recommended access patterns on how reads and writes should be implemented to get the best performance out of solid-state drives."
"TLDR","2022-04-07 10:18:09+00:00","Genie (GitHub Repo)","Genie is a full-stack web framework for developing modern web applications. It features a powerful router, websockets, templating, plugins, ORM support, and more. Examples of packages and apps made with Genie are available."
"TLDR","2022-04-07 10:18:09+00:00","Build In-App Chat + Feeds, Faster (Sponsor)","Activate your free Stream Chat trial to start building today. Qualifying small teams and personal dev projects can also apply for the free-forever Stream Maker Account."
"TLDR","2022-04-07 10:18:09+00:00","This Startup Made a Functioning 'Invisibility Shield'. Here's How It Works (3 minute read)","UK-based startup Invisibility Shield Co. sells an invisibility shield that works using an optical phenomenon called lenticular lensing. It is the same mechanism used in tilt cards which change pictures depending on the angle. The shield directs light from the subject sideways and away from the observer. This article explains how the technology works and links to resources on how to make your own. Pictures of the shield are available."
"TLDR","2022-04-07 10:18:09+00:00","Anker’s first 3D printer might be the one you’ve been waiting for (6 minute read)","Anker has announced a 3D printer that can print five times faster than its competition. The AnkerMake M5 comes with a webcam that can monitor and record prints. It prints the same size parts as other similar 3D printers at a default 250mm per second. The 3D printer is currently on Kickstarter for an early bird price of $499. A link to the project's Kickstarter page is available in the article."
"TLDR","2022-04-06 10:17:24+00:00","See how top tech companies automate their privacy (Sponsor)","From Clubhouse to Robinhood, industry-leading companies use Transcend to automate their privacy requests fulfillment, enforce consent across LDU, GPC and other Do Not Sell signals, and power a living data map. Privacy at the data layer, made easy. Learn more."
"TLDR","2022-04-06 10:17:24+00:00","Twitter is adding an edit button (2 minute read)","Twitter has announced that it will allow Twitter Blue subscribers to edit their tweets in the coming months. The feature has been frequently requested by users, but former CEO Jack Dorsey was reluctant to add it due to the potential for abuse. Elon Musk, after purchasing a 9.2% stake in Twitter, polled his followers on whether the company should add an edit button. The results were strongly in favor of the feature."
"TLDR","2022-04-06 10:17:24+00:00","Microsoft is integrating its Windows 365 Cloud PCs into Windows 11 (3 minute read)","Microsoft has announced new Cloud PC integrations into Windows 11. Windows 365 is a service that lets businesses stream a version of Windows 10 or Windows 11 in a web browser. Windows 11 PCs will now be able to boot straight to Windows 365 Cloud PCs or easily switch to them using Windows 11's virtual desktops feature. Microsoft is working on a Windows 365 offline feature that will allow users to work locally and sync data with Windows 365 when connectivity is restored. Windows 11 will soon have a native Windows 365 app."
"TLDR","2022-04-06 10:17:24+00:00","First autonomous X-ray-analyzing AI is cleared in the EU (3 minute read)","Oxipit has received regulatory clearance in the EU for its artificial intelligence tool that can read chest X-rays without oversight from a radiologist. ChestLink scans chest X-rays and sends scans with potential problems to radiologists for review. The EU certification only signals that the tool meets safety standards. Oxipit plans to obtain FDA clearance in the US, which will require the company to prove its effectiveness as well."
"TLDR","2022-04-06 10:17:24+00:00","‘Mind-blowing’: Ai-Da becomes first robot to paint like an artist (3 minute read)","Ai-Da is a humanoid robot that can paint traditionally. It was created in 2019 by a team of programmers, roboticists, art experts, and psychologists. The robot can paint, sketch, and create poems. Ai-Da will premier a solo exhibition at the 2022 Venice Biennale on April 22. Pictures of Ai-Da and examples of art created by the robot are available in the article."
"TLDR","2022-04-06 10:17:24+00:00","NeverThrow (GitHub Repo)","NeverThrow is a package for JavaScript and TypeScript that implements type-safe errors. It contains a Result type that represents either success or failure. Examples are available."
"TLDR","2022-04-06 10:17:24+00:00","How We Built r/Place (19 minute read)","Place was a project by Reddit where users could place a single colored tile on a collaborative canvas every few minutes. Each tile placed was relayed to observers in real-time. This article discusses how multiple engineering teams worked together to create Place. A link to the code for Place is available."
"TLDR","2022-04-06 10:17:24+00:00","Teleport 9 - Introducing Machine ID (Sponsor)","Big release from Teleport today! Teleport 9 now includes Machine ID: the identity-based access for machine connections. Learn more in this blog post."
"TLDR","2022-04-06 10:17:24+00:00","Elon Musk will join Twitter's board of directors (2 minute read)","Twitter is appointing Elon Musk to its board of directors. Musk will serve as a Class II director with a term that expires at Twitter's 2024 annual shareholder meeting. He is limited to holding a maximum of 14.9% of common stock during his tenure and for 90 days afterward."
"TLDR","2022-04-06 10:17:24+00:00","The Next Google (12 minute read)","The next Google will have to be more than just an input box that returns links. A new generation of search engines is being developed that takes the idea of a search engine to new directions. This article looks at new search engines and shows what they offer. It talks about Kagi, Neeva, You.com, Andi, Brave, and Goggles, and explains how these companies are innovating in the space."
"TLDR","2022-04-05 10:17:12+00:00","Build internal tools in minutes with Retool, where visual programming meets the power of real code (Sponsor)","Don't waste time wrestling together UI libraries and writing boilerplate code.Retool combines the best of visual programming and customizing apps with code. Drag and drop pre-built components and deploy functional apps instantly—with features like access controls and audit logs built-in.Amazon, Brex, Allbirds, and Volvo are building critical business apps in Retool. Start building for free today!"
"TLDR","2022-04-05 10:17:12+00:00","It’s hard to believe Samsung’s new, matte The Frame is actually a TV (3 minute read)","Samsung has introduced a matte version of its The Frame TV. The display makes artwork look almost like it is on canvas. The Frame comes in sizes ranging from 43 to 85 inches. All displays feature a 4K resolution and displays over 55 inches will have a 120Hz refresh rate. Pictures of the new matte The Frame display are available in the article."
"TLDR","2022-04-05 10:17:12+00:00","Google Play crackdown makes Amazon, Barnes & Noble pull digital purchases (3 minute read)","Google is finally enforcing its rules for using Google Play billing. The rules have always existed, but Google didn't start enforcing them until March 31. Google gave developers more than six months warning about its intentions to start enforcing the rules. Digital stores now have to sell digital items through Google Play or risk being removed from the store. Some companies, such as Netflix and Spotify, have made deals with Google to continue to allow direct purchases."
"TLDR","2022-04-05 10:17:12+00:00","Epic’s new RealityScan app can make 3D models from smartphone photos (3 minute read)","RealityScan is an app from Epic Games that can construct 3D models of objects using a series of smartphone photos. It can be used to scan real-world objects and bring them into games or other projects. The app is in a limited (and currently full) beta. Epic is hosting a 'State of Unreal' event today at 11 AM ET. A video that shows how RealityScan works is available in the article."
"TLDR","2022-04-05 10:17:12+00:00","Looking Through Mojo Vision’s Newest AR Contact Lens (5 minute read)","Mojo Vision is a company that makes Augmented Reality contact lenses. Its lenses are still in safety testing and there is still more work to be done before Mojo can apply for US FDA approval to sell to consumers. Their full-color microLED displays can display images in 3D at a resolution of 14,000 pixels per inch. The contacts have a built-in battery and a custom 5Ghz radio. This article features an interview with the senior vice president of Mojo Vision about the company's newest AR contacts. Pictures of the AR contacts are available in the article."
"TLDR","2022-04-05 10:17:12+00:00","direnv (GitHub Repo)","direnv is an extension for shell that adds the ability to load and unload environment variables depending on the current directory. It supports hooks for all common shells. direnv is language agnostic."
"TLDR","2022-04-05 10:17:12+00:00","Shoelace (Website)","Shoelace is a web component library that works with all frameworks and content delivery networks. The components are fully customizable with CSS. Shoelace allows developers to build multiple custom apps with different frameworks that all share the same UI components. Examples are available."
"TLDR","2022-04-05 10:17:12+00:00","Find a job through Hired (Sponsor)","Hired is home to thousands of companies ranging from startups to Fortune 500s that are actively hiring the best and brightest developers, data scientists, mobile engineers, and more. Here’s how it works: once you create a profile, hiring managers can extend interview requests based on desired salary, top skills, and career preferences. Sign up today - it’s completely free for job-seekers!"
"TLDR","2022-04-05 10:17:12+00:00","Elon Musk just became Twitter's largest shareholder (3 minute read)","Elon Musk has purchased a 9% stake in Twitter. Musk raised questions on whether the platform was undermining democracy and restricting free speech in recent weeks. He had considered starting a rival social media network. US security regulators have fined Musk for his tweets in the past. Musk is still facing heavy pressure from the SEC over his tweets."
"TLDR","2022-04-05 10:17:12+00:00","Single-Chip Processors Have Reached Their Limits (3 minute read)","Manufacturers are moving to multi-chip designs as the miniaturization of transistors slows down. Multi-chip designs allow manufacturers to increase transistor counts and create designs with better power efficiency and performance. While many manufacturers agree that the technology is here to stay, they are still using their own interconnect designs that are incompatible with each other. Universal Chiplet Interconnection Express is a new open standard that hopes to bring the industry together. It was only recently introduced, but a number of major organizations have not yet joined."
"TLDR","2022-04-04 10:20:04+00:00","Ready to do the most impactful work of your career? Join Reforge (Sponsor)","Reforge is the leading career development platform for product and growth professionals. Membership includes participation in 3 cohort-based programs and year-round access to content - all developed by experienced tech executives.  Apply to join today."
"TLDR","2022-04-04 10:20:04+00:00","Drone footage shows everything going on inside Tesla's Berlin Gigafactory (2 minute read)","Tesla released a video taken by a drone inside the Tesla Gigafactory in Berlin. The video shows the inside of the new factory and was shot by a company called Skynamic. It shows exactly how a Tesla assembly line works. The video is available in the article."
"TLDR","2022-04-04 10:20:04+00:00","Apple Collaborating With LG to Develop iPads and MacBooks With Foldable OLED Displays and Ultra-Thin Cover Glass (2 minute read)","Apple and LG are collaborating to develop a foldable OLED display panel with ultra-thin cover glass for future iPad and MacBook models. LG has growing expertise in foldable OLED displays and sells them to other manufacturers such as HP and Lenovo. Apple's display could be around 20-inches in size. It may be creating a new product category for the device. The device won't be launched until after 2025."
"TLDR","2022-04-04 10:20:04+00:00","Israeli bee tech startup Beewise pulls in $80m investment for robotic beehives (4 minute read)","Beewise is an Israeli startup that makes a robotic beehive that can monitor and care for honeybees around the clock. The Beehome uses robotics, artificial intelligence, imaging, a software platform, and a mobile app to look after up to 24 bee colonies at a time. It automatically controls climate and humidity and sends alerts when human intervention is required. The Beehome can even harvest the honey that its bees produce. Beewise recently announced a new version of its Beehome after raising $80 million in funding."
"TLDR","2022-04-04 10:20:04+00:00","Some AI Systems May Be Impossible to Compute (4 minute read)","There are fundamental theoretical limits to how stable and accurate AI systems can be. While there is mathematical proof that stable and accurate neural networks exist for a wide variety of problems, there may be no algorithms that can successfully compute them. There are limitations to what computers can achieve that can not be overcome with more data, computing power, or time. Knowledge about these limits could inspire more research. The limits imply the existence of a classification theory for describing neural networks that can be computed by algorithms."
"TLDR","2022-04-04 10:20:04+00:00","Transformers for software engineers (21 minute read)","The Transformer model architecture, originally introduced for machine translation, is now used for a wide range of domains, including text, audio, video, and more. This article reverse engineers the Transformer architecture and uses the language of software engineering to explain how these models work. It is an introduction to the details of the Transformer model for those with a software engineering background, particularly for those looking to do interpretability work."
