"newsletter","date","headline","body"
"datascienceweekly","2022-03-25 02:50:51+00:00","Inferring Articulated Rigid Body Dynamics from RGBD Video","Being able to reproduce physical phenomena ranging from light interaction to contact mechanics, simulators are becoming increasingly useful in more and more application domains where real-world interaction or labeled data are difficult to obtain. Despite recent progress, significant human effort is needed to configure simulators to accurately reproduce real-world behavior. We introduce a pipeline that combines inverse rendering with differentiable simulation to create digital twins of real-world articulated mechanisms from depth or RGB videos..."
"datascienceweekly","2022-03-25 02:50:51+00:00","Universities do a terrible job teaching machine learning [twitter thread]","Not only do they give you critically out-of-date information, but they focus most of their time on the least important aspects...Here 5 things everyone in industry WISHES your professor taught you:..."
"datascienceweekly","2022-03-25 02:50:51+00:00","R in Visual Studio Code","The R programming language is a dynamic language built for statistical computing and graphics. R is commonly used in statistical analysis, scientific computing, machine learning, and data visualization...The R extension for Visual Studio Code supports extended syntax highlighting, code completion, linting, formatting, interacting with R terminals, viewing data, plots, workspace variables, help pages, managing packages and working with R Markdown documents..."
"datascienceweekly","2022-03-25 02:50:51+00:00","Assessing Generalization of SGD via Disagreement","Estimating the generalization error of a model — how well the model performs on unseen data — is a fundamental component in any machine learning system. Generalization performance is traditionally estimated in a supervised manner, by dividing the labeled data into a training set and test set...in many real-world settings, a large amount of unlabeled data is readily available. How can we tap into the rich information in these unlabeled data and leverage them to assess a model’s performance without labels? In this work (full paper), we demonstrate that a simple procedure can accurately estimate the generalization error with only unlabeled data. ..."
"datascienceweekly","2022-03-25 02:50:51+00:00","Your Policy Regulariser is Secretly an Adversary","Policy regularisation can be interpreted as learning a strategy in the face of an imagined adversary; a decision-making principle which leads to robust policies. In our recent paper, we analyse this adversary and the generalisation guarantees we get from such a policy..."
"datascienceweekly","2022-03-25 02:50:51+00:00","MetaMorph: Learning Universal Controllers with Transformers","Multiple domains like vision, natural language, and audio are witnessing tremendous progress by leveraging Transformers for large scale pre-training followed by task specific fine tuning. In contrast, in robotics we primarily train a single robot for a single task. However, modular robot systems now allow for the flexible combination of general-purpose building blocks into task optimized morphologies...In this work, we propose MetaMorph, a Transformer based approach to learn a universal controller over a modular robot design space..."
"datascienceweekly","2022-03-25 02:50:51+00:00","Sentiment Analysis on News Headlines: Classic Supervised Learning vs Deep Learning Approach","An explanatory guide to develop a binary classifier to detect positive and negative news headlines using classic machine learning and deep learning techniques..."
"datascienceweekly","2022-03-25 02:50:51+00:00","The electricityMap team is hiring a data engineer to help us build and maintain a scalable data pipeline and database that forms the foundation of our mission to accelerate the energy system to a zero-carbon future.","  In your role, you’ll be making sure the quality and availability of our data is stellar by building and improving our data infrastructure, as well as managing our internal tools. You will also be responsible for managing our machine learning pipelines at scale. We’re a small team, so you’ll be owning a lot of your own work and initiatives, but we will be there to support you!    "
"datascienceweekly","2022-03-25 02:50:51+00:00","ML Course Notes","A place [on GitHub] to collaborate and share course notes on all topics related to machine learning, NLP, and AI...."
"datascienceweekly","2022-03-25 02:50:51+00:00","Step-by-step Approach to Build Your Machine Learning API Using Fast API","No matter how efficient your Machine Learning model is, it will only be useful when it creates value for the Business. This can not happen when it’s stored in a folder on your computer. In this fast-growing environment, speed and good deployment strategies are required to get your AI solution to the market!...This article explains how Fast APIcan help on that matter. We will start by having a global overview of Fast API and its illustration by creating an API..."
"datascienceweekly","2022-03-25 02:50:51+00:00","Random Forests Algorithm explained with a real-life example and some Python code","Random Forests is a Machine Learning algorithm that tackles one of the biggest problems with Decision Trees: variance..."
"datascienceweekly","2022-03-25 02:50:51+00:00","Hands-On Machine Learning with scikit-learn and Scientific Python Toolkits",""
"datascienceweekly","2022-03-17 22:52:02+00:00","A Deep Dive into NLP Tokenization and Encoding with Word and Sentence Embeddings","This is a deep dive: over 8,000 words long. Don’t be afraid to bookmark this article and read it in pieces. There is a lot to cover. We will start with basic One-Hot encoding, move on to word2vec word and sentence embeddings, build our own custom embeddings using R, and finally, work with the cutting-edge BERT model and its contextual embeddings..."
"datascienceweekly","2022-03-17 22:52:02+00:00","Making Deep Learning Go Brrrr From First Principles","So, you want to improve the performance of your deep learning model. How might you approach such a task? Often, folk fall back to a grab-bag of tricks that might've worked before or saw on a tweet. ""Use in-place operations! Set gradients to None! Install PyTorch 1.10.0 but not 1.10.1!""...It's understandable why users often take such an ad-hoc approach performance on modern systems (particularly deep learning) often feels as much like alchemy as it does science. That being said, reasoning from first principles can still eliminate broad swathes of approaches, thus making the problem much more approachable...So, if you want to keep your GPUs going brrrr, let's discuss the three components your system might be spending time on - compute, memory bandwidth, and overhead..."
"datascienceweekly","2022-03-17 22:52:02+00:00","Announcing the 2022 AI Index Report","The AI Index is an independent initiative at the Stanford Institute for Human-Centered Artificial Intelligence (HAI), led by the AI Index Steering Committee, an interdisciplinary group of experts from across academia and industry. The annual report tracks, collates, distills, and visualizes data relating to artificial intelligence, enabling decision-makers to take meaningful action to advance AI responsibly and ethically with humans in mind..."
"datascienceweekly","2022-03-17 22:52:02+00:00","The “0 / 1 / Done” Strategy for Data Science","To achieve operational excellence in applied data science delivery aim for: 0-day Handovers, 1-day Prototyping and to declare projects as Done when Completely Done. Work backwards from these goals, conducting a gap analysis between those and current team capabilities, to identify process, tooling and governance initiatives to reach them..."
"datascienceweekly","2022-03-17 22:52:02+00:00","Data salaries at FAANG companies in 2022","What 4000 data points can tell us about the state of data salaries at top tech companies..."
"datascienceweekly","2022-03-17 22:52:02+00:00","What Good Data Product Managers Do – And Why You Probably Need One","We are seeing data departments modernize their team structure with data product managers at the helm of such projects...In this article, we’ll walk through: a) What is a data product manager? How did the role evolve?, b) What is a data product?, c) What does a data product manager do? What skills do they need?, d) What background do product managers need? Who do they report to?, e) Data product manager vs product manager, f) Data product manager vs data scientist, and g) The future of the data product manager..."
"datascienceweekly","2022-03-17 22:52:02+00:00","How to Build Effective (and Useful) Dashboards","With practice I have been developing a four-step approach (that I am still fine-tuning) to build dashboards that are, first of all, effective, but also useful...In this article I want to take you through these four steps. Whether you are an experienced analyst building data visualizations all day long or a business user using dashboards from time to time, I hope you will find these guidelines useful..."
"datascienceweekly","2022-03-17 22:52:02+00:00","Future ML Systems Will Be Qualitatively Different","In 1972, the Nobel prize-winning physicist Philip Anderson wrote the essay ""More Is Different"". In it, he argues that quantitative changes can lead to qualitatively different and unexpected phenomena...In this post, I'll argue that emergence often occurs in the field of AI, and that this should significantly affect our intuitions about the long-term development and deployment of AI systems. We should expect weird and surprising phenomena to emerge as we scale up systems. This presents opportunities, but also poses important risks..."
"datascienceweekly","2022-03-17 22:52:02+00:00","Efficient Learning of Safe Driving Policy via Human-AI Copilot Optimization","Our recent #ICLR2022 work develops an efficient Human-in-the-loop learning method called HACO (Human-AI CoPilot), to mentor agents interactively to act and drive while preserving their own curiosity and exploration..."
"datascienceweekly","2022-03-17 22:52:02+00:00","Building systems to securely reason over private data","People today rely on AI systems such as assistants and chatbots to help with countless tasks...For systems to execute these tasks, users must provide them with relevant information — such as one’s location or work calendar. In some cases, however, people would prefer to keep information private, which means not uploading it to cloud-based AI systems or sharing it with others...Meta AI is releasing ConcurrentQA, the first public data set for studying information retrieval and question answering (QA) with data from multiple privacy scopes. Alongside the data set and problem exploration, we have developed a new methodology as a starting point for thinking about privacy in retrieval-based settings called Public-Private Autoregressive Information Retrieval (PAIR)..."
"datascienceweekly","2022-03-17 22:52:02+00:00","Generative Flow Networks","I [Yoshua Bengio] have rarely been as enthusiastic about a new research direction. We call them GFlowNets, for Generative Flow Networks. They live somewhere at the intersection of reinforcement learning, deep generative models and energy-based probabilistic modelling...What I find exciting is that they open so many doors, but in particular for implementing the system 2 inductive biases I have been discussing in many of my papers and talks since 2017, that I argue are important to incorporate causality and deal with out-of-distribution generalization in a rational way..."
"datascienceweekly","2022-03-17 22:52:02+00:00","The promise of AI with Demis Hassabis","Last episode of Season 2 of DeepMind: The Podcast...Hannah wraps up the series by meeting DeepMind co-founder and CEO, Demis Hassabis. In an extended interview, Demis describes why he believes AGI is possible, how we can get there, and the problems he hopes it will solve. Along the way, he highlights the important role of consciousness and why he’s so optimistic that AI can help solve many of the world’s major challenges. As a final note, Demis shares the story of a personal meeting with Stephen Hawking to discuss the future of AI and discloses Hawking’s parting message..."
"datascienceweekly","2022-03-17 22:52:02+00:00","Organizing and scaling an effective data team","Here’s a high-level sketch of how to organize and scale an effective data team..."
"datascienceweekly","2022-03-17 22:52:02+00:00","Winning at Competitive ML in 2022","Hoping to win a machine learning competition in 2022? Here’s what you need to know. I collaborated with ML Contests, using their database of over 80 competitions that took place in 2021 across Kaggle, DrivenData, AICrowd, Zindi, and 13 other platforms. Wherever the information was available, we categorized winners to figure out what made them win..."
"datascienceweekly","2022-03-17 22:52:02+00:00","The eBay Ads team focuses on building data / ML services for our advertiser sellers to guide them to optimize for their Ads budget and goals, for example by recommending the right inventory, keywords and Ads bid rate to apply for their campaigns, and eventually create campaigns automatically for advertisers. This is a relatively new area but with a very high business potential and need. It would allow you to work with massive amounts of data and use a variety of data science techniques."," We are looking for someone passionate about deploying reliable and efficient ML services to a production environment at scale. You will collaborate with researchers to invent, design and implement end-to-end production services in Python and Java/Scala using state-of-the-art big data and ML tools. Come and help us blow away the boundaries of e-commerce through AI!   If you are interested in applying, please contact the hiring manager, Dan Schonfeld, at dschonfeld@ebay.com .  "
"datascienceweekly","2022-03-17 22:52:02+00:00","Efficient Transformers: A Survey","Transformer model architectures have garnered immense interest lately due to their effectiveness across a range of domains like language, vision and reinforcement learning...Recently, a dizzying number of ""X-former"" models have been proposed - Reformer, Linformer, Performer, Longformer, to name a few - which improve upon the original Transformer architecture, many of which make improvements around computational and memory efficiency. With the aim of helping the avid researcher navigate this flurry, this paper characterizes a large and thoughtful selection of recent efficiency-flavored ""X-former"" models, providing an organized and comprehensive overview of existing work and models across multiple domains..."
"datascienceweekly","2022-03-17 22:52:02+00:00","GFlowNet Tutorial","A GFlowNet is a trained stochastic policy or generative model, trained such that it samples objects $x$ through a sequence of constructive steps, with probability proportional to $R(x)$, where $R$ is some given non-negative integrable reward function..."
"datascienceweekly","2022-03-17 22:52:02+00:00","The Bayesian Learning Rule","We show that many machine-learning algorithms are specific instances of a single algorithm called the Bayesian learning rule. The rule, derived from Bayesian principles, yields a wide-range of algorithms from fields such as optimization, deep learning, and graphical models. This includes classical algorithms such as ridge regression, Newton's method, and Kalman filter, as well as modern deep-learning algorithms such as stochastic-gradient descent, RMSprop, and Dropout..."
"datascienceweekly","2022-03-17 22:52:02+00:00","Hands-On Machine Learning with scikit-learn and Scientific Python Toolkits",""
"datascienceweekly","2022-03-11 00:04:20+00:00","Deep Learning Is Hitting a Wall","What would it take for artificial intelligence to make real progress?...."
"datascienceweekly","2022-03-11 00:04:20+00:00","MLOps Is a Mess But That's to be Expected","Today machine learning continues to be one of the most talked about and touted technology waves, promising to revolutionize every corner of society...And yet the ecosystem is in a frenzied state...New fundamental science advances come out of every week. Startups and enterprises spray new developer tools into the market trying to capture a chunk of what many speculate to be a market worth between $40-120 billion by 2025...And yet if you’re just entering the discourse, how do you make sense of it all?...In this post, I want to focus the discussion about the state of machine learning operations (MLOps) today, where we are, where we are going..."
"datascienceweekly","2022-03-11 00:04:20+00:00","Anatomy of an AI System","The Amazon Echo as an anatomical map of human labor, data and planetary resources...This is an interaction with Amazon’s Echo device. 3 A brief command and a response is the most common form of engagement with this consumer voice-enabled AI device...How can we begin to see it, to grasp its immensity and complexity as a connected form? We start with an outline: an exploded view of a planetary system across three stages of birth, life and death, accompanied by an essay in 21 parts. Together, this becomes an anatomical map of a single AI system..."
"datascienceweekly","2022-03-11 00:04:20+00:00","µTransfer: A technique for hyperparameter tuning of enormous neural networks","In this post, we relay how our fundamental research enabled us, for the first time, to tune enormous neural networks that are too expensive to train more than once. We achieved this by showing that a particular parameterization preserves optimal hyperparameters across different model sizes...By greatly reducing the need to guess which training hyperparameters to use, this technique can accelerate research on enormous neural networks, such as GPT-3 and potentially larger successors in the future..."
"datascienceweekly","2022-03-11 00:04:20+00:00","Restoring and attributing ancient texts using deep neural networks","Ancient history relies on disciplines such as epigraphy—the study of inscribed texts known as inscriptions—for evidence of the thought, language, society and history of past civilizations1. However, over the centuries, many inscriptions have been damaged to the point of illegibility, transported far from their original location and their date of writing is steeped in uncertainty. Here we present Ithaca, a deep neural network for the textual restoration, geographical attribution and chronological attribution of ancient Greek inscriptions. Ithaca is designed to assist and expand the historian’s workflow..."
"datascienceweekly","2022-03-11 00:04:20+00:00","The 2030 Self-Driving Car Bet","It's my honor to announce that John Carmack and I (Jeff Atwood) have initiated a friendly bet of $10,000* to the 501(c)(3) charity of the winner’s choice: By January 1st, 2030, completely autonomous self-driving cars meeting SAE J3016 level 5 will be commercially available for passenger use in major cities...I am betting against , and John is betting for ..."
"datascienceweekly","2022-03-11 00:04:20+00:00","Data Visualization Standards","The Data Visualization Standards (DVS) are a collection of guidance and resources to help create better data visualizations with less effort from the US Census Bureau. These standards contain both requirements and recommendations for both novices and experts to follow when creating new data visualizations..."
"datascienceweekly","2022-03-11 00:04:20+00:00","NN Template - Generic template to bootstrap your PyTorch project","Generic cookiecutter template to bootstrap PyTorch projects and to avoid writing boilerplate code to integrate: a) PyTorch Lightning, lightweight PyTorch wrapper for high-performance AI research, b) Hydra, a framework for elegantly configuring complex applications, c) Weights and Biases, organize and analyze machine learning experiments. (educational account available, d) Streamlit, turns data scripts into shareable web apps in minutes, e) MkDocs and Material for MkDocs, a fast, simple and downright gorgeous static site generator, f) DVC, track large files, directories, or ML models. Think ""Git for data"", g) GitHub Actions, to run the tests, publish the documentation and to PyPI automatically, and h) Python best practices for developing and publishing research projects..."
"datascienceweekly","2022-03-11 00:04:20+00:00","A visual introduction to machine learning","n machine learning, computers apply statistical learning techniques to automatically identify patterns in data. These techniques can be used to make highly accurate predictions...Keep scrolling. Using a data set about homes, we will create a machine learning model to distinguish homes in New York from homes in San Francisco..."
"datascienceweekly","2022-03-11 00:04:20+00:00","A Concrete Introduction to Probability (using Python)","This notebook will explore these concepts in a concrete way using Python code. The code is meant to be succint and explicit, and fast enough to handle sample spaces with millions of outcomes. If you need to handle trillions, you'll want a more efficient implementation. I also have another notebook that covers paradoxes in Probability Theory..."
"datascienceweekly","2022-03-11 00:04:20+00:00","CS 329S: Machine Learning Systems Design [Stanford, Winter 2022]","This course aims to provide an iterative framework for developing real-world machine learning systems that are deployable, reliable, and scalable...It starts by considering all stakeholders of each machine learning project and their objectives. Different objectives require different design choices, and this course will discuss the tradeoffs of those choices...Students will learn about data management, data engineering, feature engineering, approaches to model selection, training, scaling, how to continually monitor and deploy changes to ML systems, as well as the human side of ML projects such as team structure and business metrics..."
"datascienceweekly","2022-03-11 00:04:20+00:00","Explainable Machine Learning in NLP: Methods and Evaluation [PDF]","This talk is based on four recent papers: a) The Out-of-Distribution Problem in Explainability and Search Methods for Feature Importance Explanations (2021), b) FastIF: Scalable Influence Functions for Efficient Model Interpretation and Debugging (2021), c) Leakage-Adjusted Simulatability: Can Models Generate Non-Trivial Explanations of Their Behavior in Natural Language? (2020), d) Evaluating Explainable AI: Which Algorithmic Explanations Help Users Predict Model Behavior? (2020)...as well as feflection on these papers and notes from “Opinions on Interpretable Machine Learning and 70 Summaries of Recent Papers” (2021)..."
"datascienceweekly","2022-03-11 00:04:20+00:00","Rotational AI Science & Engineering (RAISE) Employment Opportunity","RAISE is an 18-month rotational program offering participants full-time employment with the Meta AI team. It is designed to bring a diverse cohort of software engineers with little to no AI/ML experience together from a wide range of industry experiences and backgrounds -- ranging from individual contributors a few years out of school to experienced engineers. After completing the 18-month program, the goal is for RAISE alumni to seamlessly continue their employment at Meta by selecting a permanent Meta AI team to join that aligns with their skills and interests. Throughout the program, all RAISErs are full-time employees, providing each individual with all the benefits of being a software engineer at Meta..."
"datascienceweekly","2022-03-11 00:04:20+00:00","Implicit Kinematic Policies: Unifying Joint and Cartesian Action Spaces in End-to-End Robot Learning","Action representation is an important yet often overlooked aspect in end-to-end robot learning with deep networks. Choosing one action space over another (e.g. target joint positions, or Cartesian end-effector poses) can result in surprisingly stark performance differences between various downstream tasks -- and as a result, considerable research has been devoted to finding the right action space for a given application...in this work, we instead investigate how our models can discover and learn for themselves which action space to use. Leveraging recent work on implicit behavioral cloning, which takes both observations and actions as input, we demonstrate that it is possible to present the same action in multiple different spaces to the same policy -- allowing it to learn inductive patterns from each space....."
"datascienceweekly","2022-03-11 00:04:20+00:00","The electricityMap team is hiring a data engineer to help us build and maintain a scalable data pipeline and database that forms the foundation of our mission to accelerate the energy system to a zero-carbon future.","  Our mission is to organise the world’s electricity data to drive tangible reductions in carbon emissions. electricityMap started as a popular open-source project 5 years ago and is now used every day by citizens, companies, universities, NGOs, and policy makers around the world to understand and reduce the climate impact of electricity.    You will be joining a fun, international and inclusive team in our mission to tackle climate change – while simultaneously building your professional experience in the rapidly growing industry of climate tech..."
"datascienceweekly","2022-03-11 00:04:20+00:00","Hands-On Reinforcement Learning Course (Part 1 of 6)","Let’s walk this beautiful path from the fundamentals to cutting edge reinforcement learning (RL), step-by-step, with coding examples and tutorials in Python, together!...This first part covers the bare minimum concept and theory you need to embark on this journey. Then, in each following chapter, we will solve a different problem, with increasing difficulty..."
